"No.","Time","Source","Destination","Protocol","Length","Info"
"1","0.000000","192.168.1.104","216.18.166.136","TCP","74","49859  >  http(80) [SYN] Seq=0 Win=8192 Len=0 MSS=1460 WS=4 SACK_PERM=1 TSval=305762 TSecr=0"
"2","0.307187","216.18.166.136","192.168.1.104","TCP","74","http(80)  >  49859 [SYN, ACK] Seq=0 Ack=1 Win=5792 Len=0 MSS=1440 TSval=1315092752 TSecr=305762 WS=512"
"3","0.307372","192.168.1.104","216.18.166.136","TCP","66","49859  >  http(80) [ACK] Seq=1 Ack=1 Win=17136 Len=0 TSval=305793 TSecr=1315092752"
